{
  "content": "随着智能化浪潮兴起，人民军队加快推进科技练兵，把智能手段引入训练场。据人民网报道，2026年初我军某部“人工智能+”首训亮相，将人工智能技术融入训练组织、目标识别、协同指挥等环节，探索新质战斗力生成路径。近两年各战区、各军兵种普遍加大无人化、智能化装备运用，无人侦察机、机器狗、机器狼等新型平台逐步列装并投入训练，实现机器代人、人机协同。科技是核心战斗力。通过把大数据、人工智能、无人技术等嵌入训练全程，官兵分析研判和精确打击能力显著增强，训练模式正由传统经验驱动向数据智能驱动转变。该案例说明，全军把科技强军摆在突出位置，坚持向科技创新要战斗力、向人才素质要战斗力，以科技和人才双引擎驱动练兵备战。",
  "document_id": "doc_939",
  "revision": 2,
  "schema_version": "1.0",
  "status": "draft",
  "title": "“人工智能+”首训亮相：科技强军助推练兵变革",
  "updated_at": "2026-08-15T16:18:49Z"
}