{
  "content": "高质量共建“一带一路”为各国带来实打实、沉甸甸的实惠，是构建人类命运共同体的最大实践平台。其实践路径可概括为：把基础设施“硬联通”作为重要方向，把规则标准“软联通”作为重要支撑，把同共建国家人民“心联通”作为重要基础——既服务构建新发展格局，又推动制度型开放，让发展成果惠及各方。它应当澄清的误解是：这是经济合作倡议而非地缘政治联盟或军事同盟，是开放包容进程而非“中国俱乐部”或所谓“陷阱”，不以意识形态划界、不搞零和游戏。它作为“国际公共产品”，与“外交为民”的民心沟通、与“积极参与全球治理”、与构建人类命运共同体“五个世界”目标紧密关联，是联通中国发展与世界发展的关键纽带。具体承接上，共建“一带一路”以互联互通将发展红利转化为共建国家的民生福祉，正是“外交为民”在外交实践中的具体落地；其坚持共商共建共享、反对单边主义的取向又同全球治理体系改革的方向一致，为实现“五个世界”美好愿景奠定设施联通与规则联通的基础。上述路径概括与“硬联通、软联通、心联通”的提法，主要依据习近平总书记在第三届“一带一路”国际合作高峰论坛开幕式上的主旨演讲（2023年10月18日）及《习近平新时代中国特色社会主义思想学习纲要》相关章节。",
  "document_id": "doc_501",
  "revision": 3,
  "schema_version": "1.0",
  "status": "draft",
  "title": "实践意义/关联",
  "updated_at": "2026-08-18T16:20:39Z"
}
