{
  "content": "'开放也是改革'，以开放促改革、促发展是我国的宝贵经验。高水平对外开放是全方位、更大范围、更宽领域、更深层次的开放。背景上，当前经济全球化遭遇逆流，单边主义、保护主义、孤立主义上升，但开放合作仍是历史潮流、全球化历史大势不可逆转，世界不会退回到相互封闭的状态。理论内涵上，习近平强调'中国开放的大门只会越开越大，永远不会关上'。要依托超大规模市场优势，以国内大循环吸引全球资源要素；坚持对内对外开放相互促进、'引进来'与'走出去'更好结合；稳步扩大规则、规制、管理、标准等制度型开放；推动共建'一带一路'高质量发展；构建面向全球的高标准自由贸易区网络。作此辨析：高水平开放已从商品和要素流动型开放走向制度型开放，凸显质量与标准层面的升级。",
  "document_id": "doc_155",
  "revision": 2,
  "schema_version": "1.0",
  "status": "draft",
  "title": "概念解析/理论背景：高水平对外开放的时代内涵",
  "updated_at": "2026-08-15T16:18:49Z"
}