{
  "content": "2021年12月3日正式通车的中老铁路，是共建绿色“一带一路”的典型工程，其生态环保理念贯穿规划、建设到运营全过程，被媒体誉为“会呼吸的绿色生态廊道”。中老铁路北起中国云南昆明、南至老挝首都万象，全线全长约1035公里，设计时速160公里。铁路穿行于云南热带雨林和老挝生态敏感区，处于亚洲象迁徙通道沿线，建设单位坚持生态选线原则与最小化扰动：在线路设计上优化走向，尽量绕避西双版纳国家级自然保护区等重点生态功能区的核心区域，并建设野生动物通道，为野生亚洲象等动物开辟涵洞等迁徙通道，降低对野生动物活动的阻隔；建设中采用先进的污水、废气处理设施和节约集约用地措施，并开展大规模生态复绿，老挝段建设期在沿线开展植树绿化、逐步形成绿色走廊。运营中，列车以电力为牵引动力，部分电能来自清洁能源并采用新型环保材料，较内燃牵引减少尾气排放。中老铁路既打通了中老间的贸易往来和人员交流，又守护了沿线雨林生态，实现交通联通与生态保护的平衡。它作为绿色“一带一路”旗舰项目，向国际社会展示了中国在海外基建中践行绿色发展理念、推动全球环境治理的负责任大国形象。信息来源：中国国家铁路集团有限公司、中国驻老挝大使馆相关公开报道。",
  "document_id": "doc_1171",
  "revision": 3,
  "schema_version": "1.0",
  "status": "draft",
  "title": "中老铁路：一条会呼吸的绿色生态廊道",
  "updated_at": "2026-08-18T16:20:39Z"
}
