{
  "content": "百年未有之大变局，指当前国际格局、全球治理体系以及人类生存发展方式正发生整体性、深层次、历史性重塑的态势。可从三个维度归纳把握：其一，国际力量对比深刻变化，新兴市场国家和发展中国家群体性崛起，多个发展中心逐渐形成，发达国家实力相对下降，'东升西降''中治西乱'更鲜明，这是近代以来国际力量对比中最具革命性的变化；其二，新一轮科技革命和产业变革深入发展，人工智能、大数据、量子技术等前沿科技重塑生产生活方式与思维方式；其三，国际体系和国际秩序深度调整，西方主导的旧秩序难以为继，发展中国家代表性和发言权扩大。同时世界进入新的动荡变革期，和平赤字、发展赤字、安全赤字、治理赤字有增无减，非传统安全威胁蔓延。变局中既有希望也有挑战，世界站在历史的十字路口，这正是中国外交面临的重大历史课题。",
  "document_id": "doc_470",
  "revision": 2,
  "schema_version": "1.0",
  "status": "draft",
  "title": "概念解析/理论背景 | 当今世界正经历百年未有之大变局",
  "updated_at": "2026-08-15T16:18:49Z"
}