{
  "content": "产权制度是社会主义市场经济体制的基石。《中共中央 国务院关于新时代加快完善社会主义市场经济体制的意见》（2020年）将'全面完善产权制度'置于突出位置，强调依法平等保护各类产权。近年来，我国以《民法典》编纂实施为载体，确立了平等保护物权、债权、股权、知识产权等各类产权的法律框架；新修订的公司法进一步完善公司治理与股东权益保护，专利法、商标法多次修订并加大知识产权侵权惩罚性赔偿力度。最高法、最高检等司法机关发布促进民营经济发展和保护产权典型案例，依法纠正涉产权冤错案件，提振经营主体信心；民营经济促进法亦被列为重点立法加快制定，从制度上保障民营企业合法权益。市场经济本质上是法治经济、产权经济，保护产权就是保护生产力。完善产权制度与公平竞争制度，为高水平社会主义市场经济体制和高质量发展筑牢制度底座。",
  "document_id": "doc_815",
  "revision": 2,
  "schema_version": "1.0",
  "status": "draft",
  "title": "强化产权保护：构筑高水平市场经济制度基础",
  "updated_at": "2026-08-15T16:18:49Z"
}