{
  "content": "培养人才是国家和民族长远发展大计。'千秋基业，人才为先'，国家发展靠人才、民族振兴靠人才。人才是人力资源中能力和素质较高的劳动者，在国家发展中具有重要战略地位。古往今来人才都是富国之本、兴邦大计；在信息化、知识经济和创新驱动的时代，人才已成为推动社会发展最活跃最积极的因素。教材从两方面展开：一是人才竞争决定国家命运，谁拥有一流人才谁就拥有发展优势和主导权，哪个国家拥有人才优势哪个国家最终就会拥有实力优势，当今各国都竞相将增强人才优势上升为国家战略；二是加快人才队伍建设是推动国家发展、实现民族复兴的必然要求，到本世纪中叶建成社会主义现代化强国，对人才队伍建设提出更高要求，包括实现经济科技综合国力大幅跃升、高水平科技自立自强、建成现代化经济体系、建成几个强国等，都需建设规模宏大、结构合理、素质优良的人才队伍。必须增强忧患意识、加快建立人才资源竞争优势。",
  "document_id": "doc_224",
  "revision": 2,
  "schema_version": "1.0",
  "status": "draft",
  "title": "概念解析/理论背景：人才为国之本",
  "updated_at": "2026-08-15T16:18:49Z"
}