{
  "content": "从2008年我国首条设计时速350公里的京津城际铁路通车，到如今全国高铁运营里程超过4.5万公里、稳居世界第一，中国高铁用十几年时间完成了从“跟在后面学”到“站在前面领跑”的历史性跨越。以自主研制的“复兴号”动车组为代表，时速350公里商业运营成为全球标杆，运营速度长期处于世界领先水平。高铁网连接起主要城市群，深刻改变了区域经济格局和人民生活方式，成为“中国制造”和“中国标准”走向世界的亮丽名片。高铁建设的每一步都凝结着自主创新的努力——钢轨、动车、信号、检测等系统实现国产化，攻关了多项关键核心技术。高铁飞驰背后，是中国基建能力的整体跃升和集中力量办大事的制度优势。它是中国式现代化进程中“硬核”成就的生动缩影，展现出中国用几十年走完别国上百年的工业化、现代化历程的磅礴力量。",
  "document_id": "doc_665",
  "revision": 2,
  "schema_version": "1.0",
  "status": "draft",
  "title": "中国高铁：从追赶到领跑的世界奇迹",
  "updated_at": "2026-08-15T16:18:49Z"
}