{
  "content": "解决大党独有难题，关键在于把全面从严治党不断引向深入、落到实处。党的十八大以来，党中央坚持全面从严治党永远在路上，实现由治标为主向标本兼治的重大转变：保持不敢腐的高压震慑，党的十八大至2023年底，全国纪检监察机关立案审查调查中管干部数百名、处分党员和公职人员数百万人，形成强大威慑；扎紧不能腐的制度笼子，制定修订《中国共产党廉洁自律准则》《党内监督条例》《巡视工作条例》等一批制度，让制度成为刚性约束；筑牢不想腐的思想堤坝，持续深化党的创新理论武装。在监督体系上，健全党统一领导、全面覆盖、权威高效的监督体系，完善纪律监督、监察监督、派驻监督、巡视监督统筹衔接，深化政治巡视、实现巡视巡察上下联动。在重点领域，深入开展金融、国企、能源等系统腐败治理。全面从严治党这场深刻革命，破解了一个个管党治党的老大难问题，推动党内政治生态根本好转，充分证明我们党有勇气、有智慧、有能力解决大党独有难题，走好新的赶考之路。",
  "document_id": "doc_992",
  "revision": 2,
  "schema_version": "1.0",
  "status": "draft",
  "title": "全面从严治党向纵深发展：从治标为主到标本兼治",
  "updated_at": "2026-08-15T16:18:49Z"
}