{
  "content": "打击治理电信网络诈骗，是新时代平安中国建设和国家安全成就的缩影。反电信网络诈骗法2022年施行以来，我国构建了打防管控一体的综合治理格局。据公安部数据，2024年全国公安机关共破获电信网络诈骗案件29.4万起，有力遏制了此类犯罪高发势头。国家反诈中心APP持续发挥拦截预警作用，公安机关依托预警劝阻加资金拦截机制，当年紧急拦截止付涉诈资金超2170亿元，守护群众钱袋子。各地派出所民警、网格员走村入户开展反诈宣传，银行、运营商与公安机关联动，断卡行动斩断黑灰产链条。通过政府主导、部门协同、全民参与，我国电信网络诈骗立案数和损失数明显下降，群众安全感显著提升。这一成就体现的是总体国家安全观下维护网络空间和人民财产安全的整体战，也是新时代国家治理体系和治理能力现代化的具体体现，为人民群众创造了安全稳定的社会环境。",
  "document_id": "doc_1173",
  "revision": 2,
  "schema_version": "1.0",
  "status": "draft",
  "title": "全民反诈：2024年全国破获电信网络诈骗案件29.4万起",
  "updated_at": "2026-08-15T16:18:49Z"
}