{
  "content": "党的力量来自组织，党的全面领导、党的全部工作要靠党的坚强组织体系去实现。\n党的十八大以来，我们党提出和坚持新时代党的组织路线，大力加强党的组织体系和干部队伍建设，为实现新时代党的历史使命提供坚强组织保证。\n要深入落实新时代党的组织路线，增强党组织政治功能和组织功能，建设堪当民族复兴重任的干部队伍，使党的各级组织都健全、都过硬。\n严密党的组织体系是重点。\n我们党建立了包括党的中央组织、地方组织、基层组织在内的上下贯通、执行有力的严密组织体系，这是世界上任何其他政党都不具有的强大优势。\n各级党组织要履行党章赋予的各项职责，把党的路线方针政策和党中央决策部署贯彻落实好。\n中央和国家机关是贯彻落实党中央决策部署的“最初一公里”,要建设成为讲政治、守纪律、负责任、有效率的模范机关。\n地方党委是贯彻落实党中央决策部署的“中间段”,要建设成为坚决听从党中央指挥、管理严格、监督有力、班子团结、风气纯正的坚强组织。\n基层党组织是贯彻落实党中央决策部署的“最后一公里”,要坚持大抓基层的鲜明导向，把各领域基层党组织建设成为宣传党的主张、贯彻党的决定、领导基层治理、团结动员群众、推动改革发展的坚强战斗堡垒。\n党员是党的活动的主体，要提高党员发展质量，加强党员教育管理，使广大党员在改革发展稳定中充分发挥先锋模范作用。\n建设高素质专业化干部队伍是关键。\n忠诚干净担当是党对领导干部提出的政治要求。\n忠诚，就是要始终忠诚于党，自觉从思想上政治上行动上同党中央保持高度一致，服从组织、立志为民、襟怀坦白；干净，就是要做到克已奉公、以俭修身，永葆清正廉洁的政治本色；担当，就是要积极为党分忧、为国尽责、为民奉献，发扬斗争精神、增强斗争本领，敢于斗争、善于斗争。\n要坚持党管干部原则，坚持“信念坚定、为民服务、勤政务实、敢于担当、清正廉洁”的新时代好干部标准，做好干部培育、选拔、管理、使用工作，建立健全源头培养、跟踪培养、全程培养的素质培养体系，日常考核、分类考核、近距离考核的知事识人体系，以德为先、任人唯贤、人事相宜的选拔任用体系，管思想、管工作、管作风、管纪律的从严管理体系和崇尚实干、带动担当、加油鼓劲的正向激励体系。",
  "document_id": "doc_517",
  "revision": 2,
  "schema_version": "1.0",
  "status": "draft",
  "title": "贯彻新时代党的组织路线 · 原文要义",
  "updated_at": "2026-08-15T16:18:49Z"
}