{
  "content": "立德树人被确立为教育的根本任务，其核心是解决好培养什么人、怎样培养人、为谁培养人这'教育的根本问题'，这是建设教育强国的核心课题。'育人'在于'立德'，教育传授的不只是知识，更重要的是价值观塑造、能力锻造和人格养成。培养什么人：要培养德智体美劳全面发展的社会主义建设者和接班人，'定语就是社会主义'，这是我们培养人的本质规定。怎样培养人：坚持系统思维，全党全社会齐抓共管，推进大中小学思想政治教育一体化，发挥思想政治理论课关键作用，履行家庭第一所学校、家长第一任老师责任，实现全员、全过程、全方位育人。为谁培养人：培养拥护党的领导、为国为党育才的有用人才，坚持为党育人、为国育才。三者环环相扣，共同回答教育的方向、内容与使命。用习近平新时代中国特色社会主义思想铸魂育人、加强社会主义核心价值观教育是落实的关键举措。",
  "document_id": "doc_209",
  "revision": 2,
  "schema_version": "1.0",
  "status": "draft",
  "title": "概念解析/理论背景：立德树人的根本问题",
  "updated_at": "2026-08-15T16:18:49Z"
}