{
  "content": "全面依法治国是一个庞大的系统工程，涉及改革发展稳定、内政外交国防、治党治国治军等各个方面。习近平指出：\"全面推进依法治国涉及很多方面，在实际工作中必须有一个总揽全局、牵引各方的总抓手，这个总抓手就是建设中国特色社会主义法治体系。依法治国各项工作都要围绕这个总抓手来谋划、来推进。\"\n建设中国特色社会主义法治体系、建设社会主义法治国家，是坚持和发展中国特色社会主义的内在要求。我们党对法治建设目标的认识经历了一个不断深化的过程。党的十五大明确提出形成中国特色社会主义法律体系的重大任务。进入新时代，党的十八届四中全会将建设中国特色社会主义法治体系、建设社会主义法治国家确定为全面推进依法治国总目标，将建设中国特色社会主义法治体系确定为全面推进依法治国的总抓手，并作出顶层设计和战略部署。从形成中国特色社会主义法律体系到建设中国特色社会主义法治体系，是我们党深化对中国特色社会主义法治建设规律性认识形成的重大成果，为中国特色社会主义事业长远发展提供了有力法治支撑。\n中国特色社会主义法治体系，本质上是中国特色社会主义制度的法律表现形式。我们党领导人民不断探索实践，逐步形成了中国特色社会主义国家制度和法律制度，为当代中国发展进步提供了根本保障。党的十八大以来，我们健全党的领导体制机制，加强人民当家作主制度建设，完成宪法部分内容修改，深化司法体制综合配套改革，建立国家监察制度，加强党内法规体系建设，中国特色社会主义法治体系不断完善。实践充分证明，建设中国特色社会主义法治体系、建设社会主义法治国家是实现国家治理体系和治理能力现代化的必然要求，也是全面深化改革的必然要求，有利于在法治轨道上推进国家治理体系和治理能力现代化，有利于在全面深化改革总体框架内推进全面依法治国各项工作，有利于在法治轨道上不断深化改革。",
  "document_id": "doc_277",
  "revision": 2,
  "schema_version": "1.0",
  "status": "draft",
  "title": "全面推进依法治国的总抓手 · 原文要义",
  "updated_at": "2026-08-15T16:18:49Z"
}