{
  "content": "统筹发展和安全在实践上意义重大，是把握国家安全主动权、构建新安全格局的重要前提。实践要求包括：一是既善于运用发展成果夯实国家安全的实力基础，又善于塑造有利于经济社会发展的安全环境，实现以发展促安全、以安全保发展；二是牢牢守住安全发展这条底线，把国家发展建立在更加安全、更为可靠的基础之上，增强生存力、竞争力、发展力、持续力，确保中华民族伟大复兴进程不被迟滞甚至中断；三是统筹维护国家安全各类要素、各个领域、各方资源、各种手段，主动塑造于我有利的外部安全环境；四是推动发展和安全深度融合，实现高质量发展和高水平安全的良性互动。这一知识点与\"以新安全格局保障新发展格局\"\"总体国家安全观\"紧密关联：总体国家安全观提供了统筹方法论，而构建新安全格局正是统筹发展和安全的战略载体。它从战略全局回答了如何处理经济建设与安全保障、发展与安全的辩证关系，是贯穿新时代国家安全工作始终的一条主线。",
  "document_id": "doc_399",
  "revision": 2,
  "schema_version": "1.0",
  "status": "draft",
  "title": "统筹发展和安全——实践意义与关联",
  "updated_at": "2026-08-15T16:18:49Z"
}