{
  "content": "2017年，具有完全自主知识产权的“复兴号”中国标准动车组在京沪高铁率先投入运营，标志着中国高铁技术实现自主化跨越。中国铁路取得这一成就的背后是长期攻关：高铁动车组曾是“引进—消化—吸收—再创新”的经典样本，而复兴号则由我国自主设计研制，在262项重要标准中中国标准占比达84%，关键部件全部实现国产化，运行速度、平稳性、节能性居世界前列。时至今日，中国高铁运营里程稳居世界第一，覆盖全国绝大多数百万人口以上城市，“四纵四横”到“八纵八横”路网不断加密。从“和谐号”到“复兴号”，从技术引进到标准输出，中国高铁以举国协同、自主创新铸就“国家名片”，有力印证了“科技强则国家强”、把核心技术掌握在自己手里的深刻道理。",
  "document_id": "doc_839",
  "revision": 2,
  "schema_version": "1.0",
  "status": "draft",
  "title": "复兴号中国标准动车组：从“追赶”到“领跑”",
  "updated_at": "2026-08-15T16:18:49Z"
}