{
  "content": "本节点的实践意义在于为建军治军提供施力准则：以听党指挥做强军之魂，确保绝对忠诚、绝对纯洁、绝对可靠，筑牢军队建设的政治根基；以能打胜仗为唯一根本标准，把作战能力作为军队存在的根本价值，使一切建设和工作向打仗聚焦，锻造召之即来、来之能战、战之必胜的精兵劲旅；以作风优良为保证，正风肃纪、反腐惩恶，永葆人民军队政治本色、防止‘病菌’侵蚀。在实践中三者不可偏废、必须整体把握。它与前面‘接续奋斗’节点承接，回答了强军目标‘强什么’；又为后续‘坚持党对军队绝对领导’‘全面加强练兵备战’等节点的具体部署提供了理论依据——军魂、战斗力标准、作风建设的展开正是这三条内涵的落实，形成‘目标—内涵—举措’的完整链条。",
  "document_id": "doc_426",
  "revision": 2,
  "schema_version": "1.0",
  "status": "draft",
  "title": "实践意义/关联：把握强军的关键抓手",
  "updated_at": "2026-08-15T16:18:49Z"
}