{
  "content": "党的基本理论、基本路线、基本方略，事关党的前途命运，事关中国特色社会主义事业兴衰成败。历史和现实充分证明，我们党团结带领全国各族人民探索形成的党的基本理论、基本路线、基本方略是完全正确的，必须长期坚持、全面贯彻。\n党的基本理论是坚持和发展中国特色社会主义的行动指南。拥有马克思主义科学理论指导是我们党鲜明的政治品格和强大的政治优势，是我们党坚定信仰信念、把握历史主动的根本所在。中国共产党自成立以来，就坚持把马克思主义写在自己的旗帜上，不断推进马克思主义中国化时代化，先后取得了毛泽东思想、邓小平理论、\"三个代表\"重要思想、科学发展观、习近平新时代中国特色社会主义思想等重大理论成果，以科学理论有力引领推动伟大实践。中国共产党为什么能，中国特色社会主义为什么好，归根到底是马克思主义行，是中国化时代化的马克思主义行。习近平新时代中国特色社会主义思想是新时代中国共产党的思想旗帜，是新时代党和国家事业发展的根本遵循。坚持党的基本理论，就是要坚定马克思主义信仰，坚持马克思主义指导地位，坚持不懈用习近平新时代中国特色社会主义思想凝心铸魂，用党的基本理论指导实践、推动工作。\n党的基本路线是国家的生命线、人民的幸福线。这条基本路线是在深刻总结社会主义建设历史经验教训、科学分析社会主义初级阶段主要任务的基础上探索形成的。党在社会主义初级阶段的基本路线是：领导和团结全国各族人民，以经济建设为中心，坚持四项基本原则，坚持改革开放，自力更生，艰苦创业，为把我国建设成为富强民主文明和谐美丽的社会主义现代化强国而奋斗。党的基本路线明确了中国特色社会主义发展的历史方位、主体力量、兴国之要、立国之本、强国之路和奋斗目标，必须牢牢坚持、毫不动摇。\n党的十九大概括的以\"十四个坚持\"为主要内容的基本方略，涵盖了坚持党的全面领导和全面从严治党，涵盖了\"五位一体\"总体布局和\"四个全面\"战略布局，涵盖了国防和军队建设、维护国家安全、\"一国两制\"和祖国统一、对外战略等方面，反映了我们党对建设中国特色社会主义的规律性认识。要全面贯彻党的基本方略，坚持党的最高纲领和基本纲领的统一，坚持党治国理政的重大方针政策和原则，为实现第二个百年奋斗目标、实现中华民族伟大复兴中国梦而不懈奋斗。",
  "document_id": "doc_37",
  "revision": 2,
  "schema_version": "1.0",
  "status": "draft",
  "title": "全面贯彻党的基本理论、基本路线、基本方略 · 原文要义",
  "updated_at": "2026-08-15T16:18:49Z"
}