{
  "content": "落实立德树人根本任务，要求把立德树人内化到教育各领域各环节，作为检验教育工作的根本标准。实践上：着力开展马克思主义理论教育，加强远大理想和共同理想教育、社会主义核心价值观教育；促进学生全面发展、学有所长，养成高尚道德品质、厚植爱国情怀、践行社会主义核心价值观；强化协同育人，家庭学校社会各尽其责，思政课讲深讲透讲活。它与'教育是基石'节点衔接，是教育强国建设的灵魂；与'人民满意的教育'中德智体美劳全面发展、拔尖创新人才培养等要求贯通。坚持立德树人就把握住了社会主义办学方向、巩固了党对教育工作的领导，是把教育优势转化为人才优势的价值前提。",
  "document_id": "doc_210",
  "revision": 2,
  "schema_version": "1.0",
  "status": "draft",
  "title": "实践意义/关联：把立德树人贯穿教育全过程",
  "updated_at": "2026-08-15T16:18:49Z"
}