{
  "content": "背景：“五位一体”总体布局将生态文明建设纳入其中，强调人与自然和谐共生。浙江安吉余村正是践行“绿水青山就是金山银山”理念的经典样本。经过：早年的余村靠开矿、办水泥厂致富，但生态环境遭到破坏。本世纪初，余村关停矿山与水泥厂，转型发展乡村旅游与绿色经济，成为“两山”理念的首倡地和实践地。关键细节：余村抓住生态优势，发展民宿、竹林经济和地质公园，村庄面貌焕然一新，村民收入从主要依赖矿业转向旅游服务业，集体经济和村民人均可支配收入持续增长，由“卖石头”转为“卖风景”，并带动周边村庄联动发展。意义：余村的绿色转身是统筹推进“五位一体”中生态文明建设与经济高质量发展协调统一成功的缩影，证明保护生态环境就是保护生产力，为全国生态文明示范建设和“两山”转化提供了可复制、可推广的经验。",
  "document_id": "doc_1007",
  "revision": 2,
  "schema_version": "1.0",
  "status": "draft",
  "title": "“两山”理念发源地——安吉余村的生态文明蝶变实践",
  "updated_at": "2026-08-15T16:18:49Z"
}