{
 "schema_version": "1.0",
 "revision": 1,
 "status": "published",
 "updated_at": "2026-08-11T00:00:00Z",
 "document_id": "doc_403",
 "title": "维护重点领域国家安全 · 原文要义",
 "content": "构建统筹各领域安全的新安全格局，维护重点领域国家安全是主阵地、主战场。要聚焦重点、抓纲带目，统筹推进各重点领域国家安全工作。\n维护国土安全。国土安全是立国之基，老祖宗留下来的领土一寸也不能丢，我们决不会坐视领土完整受到侵犯。我国既是陆地大国，也是海洋大国，拥有广泛的海洋战略利益。要提升维护国土安全能力，加强边防、海防、空防建设，坚决捍卫领土主权和海洋权益，有效遏制侵害我国国土安全的各种图谋和行为，筑牢国土安全的铜墙铁壁。坚决反对一切分裂祖国的活动，深入打击恐怖主义、分裂主义、极端主义\"三股势力\"，坚决防范\"藏独\"\"东突\"，坚决粉碎任何\"台独\"分裂图谋，全力维护香港、澳门长期繁荣稳定。\n维护经济安全。经济安全是国家安全的基础，在风云变幻的世界经济大潮中，能不能驾驭好我国经济这艘大船，是对我们党的重大考验。要保证基本经济制度安全，维护社会主义市场经济秩序，保障关系国民经济命脉的重要行业和关键领域安全。加快建设现代化经济体系，提升产业链供应链韧性和安全水平。加强金融、地方债务风险防控，守住不发生系统性风险的底线。保障经济社会发展所需的资源能源持续、可靠和有效供给。全方位夯实粮食安全根基，牢牢守住18亿亩耕地红线，强化农业科技和装备支撑，确保中国人的饭碗牢牢端在自己手中。加强自主创新能力建设，加快发展自主可控的战略高新技术和重要领域关键核心技术，保障重大技术和工程的安全。\n维护社会安全。社会安全与人民群众切身利益关系最密切，是人民群众安全感的晴雨表，是社会安定的风向标。习近平指出：\"平安是老百姓解决温饱后的第一需求，是极重要的民生，也是最基本的发展环境。\"要着力防范管控各类社会风险，妥善处置影响国家安全的突发事件，确保社会安定有序。强化社会治安整体防控，编织全方位、立体化的公共安全网，推进扫黑除恶常态化，依法严惩群众反映强烈的各类违法犯罪活动，发展壮大群防群治力量，努力使人民群众安全感更有保障。\n维护网络、人工智能、数据安全。习近平指出：\"没有网络安全就没有国家安全，就没有经济社会稳定运行，广大人民群众利益也难以得到保障。\"当今世界，围绕网络空间发展主导权、制网权的争夺日趋激烈，网络安全威胁和风险日益突出，要深化网络综合治理，形成从技术到内容、从日常安全到打击犯罪的网络治理合力，不断增强网络安全防御能力和威慑能力。人工智能发展可能带来改变就业结构、冲击法律和社会伦理、侵犯个人隐私、挑战国际准则等问题，要加快建立人工智能安全监管和评估体系，构建人工智能安全监测预警机制，确保人工智能安全、可靠、可控。数据对经济发展、社会治理、国家管理、人民生活有重要影响，要加强关键信息基础设施安全保护，强化国家关键数据资源保护能力，增强数据安全预警和溯源能力。\n维护生物安全和公共卫生安全。生物安全问题已经成为全世界、全人类面临的重大生存和发展威胁之一，重大传染病和生物安全风险是事关国家安全和发展、事关社会大局稳定的重大风险挑战。要深刻认识新形势下加强生物安全建设的重要性和紧迫性，加强国家生物安全风险防控和治理体系建设，强化系统治理和全链条防控，织牢织密生物安全风险监测预警网络，提高国家生物安全治理能力，切实筑牢国家生物安全屏障。我国是一个有着14亿多人口的大国，防范化解重大疫情和重大突发公共卫生风险，始终是须臾不可放松的大事。要健全国家重大疫情监控网络，提高应对重大突发公共卫生事件的能力和水平，加快提高疫病防控和公共卫生领域的战略科技力量和战略储备能力。\n维护外部安全。安全问题早已超越国界，任何一个国家的安全问题积累到一定程度，都可能外溢成为区域性甚至全球性安全问题。要推进国际共同安全，高举合作、创新、法治、共赢的旗帜，不断完善参与国际和区域安全合作的机制，推动建设有关领域安全治理新机制新规则，为全球安全治理贡献智慧和力量。切实维护我国海外利益安全，保护海外中国公民、组织和机构的安全和正当权益，努力形成强有力的海外利益安全保障体系。\n党的二十大对推进国家安全体系和能力现代化、坚决维护国家安全和社会稳定作出战略部署。开创新时代国家安全工作新局面，要正确认识和把握重大国家安全问题，推进国家安全体系和能力现代化，推动建设更高水平的平安中国，着力提高防范化解重大风险能力和水平，不断塑造总体有利的国家安全战略态势。"
}