{
  "content": "在广东深圳，深圳职业技术大学把产教融合当作办好职业教育的生命线，走出了一条教育、科技、人才一体推进的办学新路。学校对接深圳新一代信息技术、高端装备等支柱产业，主动与企业共建产业学院，将专业群整体“下沉”到产业链上，与汇川技术等龙头企业联合开展人才培养。课程由学校教师和企业工程师共同设计，一批来自生产一线的真实项目导入课堂，学生“入学即入行”。不少专业实现“毕业即上岗”，部分毕业生尚未离校就被企业锁定。据统计，深职大毕业生就业率与岗位适配度高，为企业转型升级“定制化”培养了大批高技能人才，成为全国职业院校产教融合的标杆。此举的意义在于：它证明高校人才培养只有与产业需求、创新链条紧密结合，才能把“教育升级”转化为“人才价值”和“发展动能”，正是教育科技人才一体化发展的生动实践。",
  "document_id": "doc_655",
  "revision": 2,
  "schema_version": "1.0",
  "status": "draft",
  "title": "深圳职业技术大学：把专业群建在产业链上",
  "updated_at": "2026-08-15T16:18:49Z"
}