{
  "content": "我国社会主要矛盾已经转化为人民日益增长的美好生活需要和不平衡不充分的发展之间的矛盾，区域发展不平衡尤为突出。川藏铁路是补齐西部、特别是西藏发展短板的标志性工程。2020年11月8日，川藏铁路雅安至林芝段在四川和西藏同时动工，这是全线最难啃的硬骨头：正线全长约1011公里，桥隧比超过95%，沿线高差大、穿越多条地震断裂带，高原、冻土等地质难题世界罕见，雅林段总投资约3198亿元。川藏铁路是我国继青藏铁路之后又一条进藏天路。项目建成后将结束西藏东部地区没有铁路的历史，极大改善沿线群众出行和物资流通条件，服务特色产业发展与人民生活改善。川藏铁路的规划建设，正是党和国家直面区域、城乡之间发展不平衡不充分问题，通过重大基础设施投资缩小差距、促进共同富裕的生动实践，呼应了人民对更加美好生活的迫切需要。",
  "document_id": "doc_736",
  "revision": 2,
  "schema_version": "1.0",
  "status": "draft",
  "title": "川藏铁路开建：补齐西部发展的最大短板",
  "updated_at": "2026-08-15T16:18:49Z"
}