{
  "content": "2019年11月2日，习近平总书记在上海市长宁区虹桥街道古北市民中心考察时指出“人民民主是一种全过程的民主”，这一重要论断后来被理论概括为“全过程人民民主”重大理念。虹桥街道是2015年7月全国人大常委会法工委设立的首批基层立法联系点之一，也是首个设在街道层面的基层立法联系点，让居民在家门口就能参与国家立法。据上海市人大常委会及中国人大网公开报道，联系点设立以来，累计就《中华人民共和国未成年人保护法》《上海市养老服务条例》等多部法律草案开展意见征询，大量群众意见被吸收进相关法律条文。联系点还延伸到华东政法大学附中等单位设立信息采集点，让老年人、青少年等各年龄段群众都能参与表达。从群众通过口头、网络等方式随时“下单”立法需求，到定期举办的立法讨论会，虹桥街道生动呈现了“民主选举、民主协商、民主决策、民主管理、民主监督”的完整链条。作为全过程人民民主的基层实践，这个联系点用真实可感的案例说明：人民民主是全链条、全方位、全覆盖的民主，群众的真知灼见能够通过制度化渠道直达国家立法机关。",
  "document_id": "doc_850",
  "revision": 3,
  "schema_version": "1.0",
  "status": "draft",
  "title": "虹桥街道基层立法联系点：民意搭上国家立法“直通车”",
  "updated_at": "2026-08-18T16:20:39Z"
}
