{
  "content": "维护国家主权、安全、发展利益是我国对外工作的出发点和落脚点，是中国外交的神圣使命。习近平指出：\"我们要坚持走和平发展道路，但决不能放弃我们的正当权益，决不能牺牲国家核心利益。任何外国不要指望我们会拿自己的核心利益做交易，不要指望我们会吞下损害我国主权、安全、发展利益的苦果。\"\n我国外交工作始终站在维护国家利益和民族尊严的前线。中国在一穷二白的时候敢于维护国家利益、反对世界强权，从未在外来压力下弯过腰、低过头，现在中国发展强大了，更不会屈服于任何外来压力。无论国际形势如何变幻，维护国家利益这一我国对外工作的根本任务没有变，也不能变。要坚决维护国家主权和领土完整，坚决反制任何侵犯我国主权、干涉我国内政的错误行径，决不允许任何人任何势力侵犯和分裂祖国的神圣领土。要在涉及国家核心利益的问题上亮明原则立场、划出红线、捍卫底线，综合运用各种外交手段，及时有力进行处置，充分展示中国政府和人民维护国家利益的决心和意志。要加强重大外交活动规划，积极向国际社会阐明我们的原则立场和正义要求，善于凝聚各方共识，赢得更多的理解和支持。\n维护国家主权、安全、发展利益，必须敢于斗争、善于斗争。中国的和平发展不会一帆风顺。我们不惹事，但也不怕事。在涉及中国共产党的领导地位、社会主义制度、国家根本利益和重大关切问题上，要敢于亮剑，坚决斗争。坚决反对打着民主的旗号、利用人权的幌子干涉中国内政的行径，反对各种无理讹诈、单边制裁和极限施压，坚定维护国家核心利益和民族尊严。要把斗争精神和斗争艺术结合起来，不回避矛盾和问题，注重策略方法，坚持有理有利有节，妥善处理同相关国家的分歧，团结一切可以团结的力量，调动一切积极因素，在斗争中争取团结，在斗争中谋求合作，在斗争中争取共赢。",
  "document_id": "doc_484",
  "revision": 2,
  "schema_version": "1.0",
  "status": "draft",
  "title": "坚决维护国家主权、安全、发展利益 · 原文要义",
  "updated_at": "2026-08-15T16:18:49Z"
}